<?xml version='1.0' encoding='utf-8'?>

<knora xmlns="https://dasch.swiss/schema"
       xmlns:xsi="http://www.w3.org/2001/XMLSchema-instance"
       xsi:schemaLocation="https://dasch.swiss/schema ../../../src/dsp_tools/resources/schema/data.xsd"
       shortcode="4123"
       default-ontology="testonto">

    <resource label="no_replacements" restype=":foo" id="no_replacements">
        <text-prop name=":bar">
            <text encoding="xml">Text</text>
        </text-prop>
    </resource>

    <resource label="resptr_only" restype=":foo" id="resptr_only">
        <text-prop name=":bar">
            <text encoding="xml">Text</text>
        </text-prop>
        <resptr-prop name=":foo-bar">
            <resptr>no_replacements</resptr>
            <resptr>salsah_link_only</resptr>
        </resptr-prop>
    </resource>

    <resource label="salsah_link_only" restype=":foo" id="salsah_link_only">
        <text-prop name=":bar">
            <text encoding="xml">
                Text with a <a class="salsah-link" href="IRI:no_replacements:IRI">link to no_replacements</a>
            </text>
        </text-prop>
    </resource>

    <resource label="resptr_and_salsah_link" restype=":foo" id="resptr_and_salsah_link">
        <text-prop name=":bar">
            <text encoding="xml">
                Text with a <a class="salsah-link" href="IRI:no_replacements:IRI">link to no_replacements</a>
            </text>
        </text-prop>
        <resptr-prop name=":foo-bar">
            <resptr>no_replacements</resptr>
        </resptr-prop>
    </resource>

</knora>
