<?xml version='1.0' encoding='utf-8'?>

<knora xmlns="https://dasch.swiss/schema"
       xmlns:xsi="http://www.w3.org/2001/XMLSchema-instance"
       xsi:schemaLocation="https://dasch.swiss/schema ../../../src/dsp_tools/resources/schema/data.xsd"
       shortcode="9999"
       default-ontology="onto">

    <resource label="Empty" restype=":ClassWithEverything" id="id_0"/>

    <resource label="Card 0-1" restype=":ClassInheritedCardinality" id="id_1">
        <boolean-prop name=":testBoolean">
            <boolean>true</boolean>
        </boolean-prop>
    </resource>

    <resource label="Card 1" restype=":ClassInheritedCardinalityOverwriting" id="id_2">
        <boolean-prop name=":testBoolean">
            <boolean>true</boolean>
        </boolean-prop>
    </resource>

    <resource label="Card Mixed" restype=":ClassInheritedCardinalityOverwriting" id="id_3">
        <boolean-prop name=":testBoolean">
            <boolean>true</boolean>
        </boolean-prop>
        <decimal-prop name=":testDecimalSimpleText">
            <decimal>2.71</decimal>
        </decimal-prop>
        <integer-prop name=":testIntegerSimpleText">
            <integer>1</integer>
            <integer>2</integer>
        </integer-prop>
        <decimal-prop name=":testDecimalSpinbox">
            <decimal>2.71</decimal>
            <decimal>2.00</decimal>
        </decimal-prop>
    </resource>

</knora>
